{
  "schema_version": "3.0",
  "skill_code": "user-validation-designer",
  "version": "1.1.0",
  "content_sha256": "2fd4d2d965d9277cc484560f989c402e9ddbbf8e65e4b5c3032c7f56071174e6",
  "package_sha256": "be0e90a9ec0f45283f3267e3cb8f9bb055cd92f0e7a414a0a2eeff2c1dbf99e1",
  "runner_sha256": "064be6a3a5e8651c466e5ab5509980e69626832d2ea1d01b6fa6ece84e834b5c",
  "prompt_sha256": "dbaf93709383dafa8d811247269e1bcb558989bd83c79d0b8fb0dc1a36d91b0e",
  "knowledge_package_sha256": "a861d0510da73b20583de36e968fe95d3d3c82dee911493a00b21d97d18e7b1d",
  "input_schema_ref": "../../../user-validation-designer/schema/input.schema.json",
  "input_schema_sha256": "676b1d0968b1337bae5aa60dd148a17b94f885b874eddbb68cc1ea3ab816ce05",
  "output_schema_ref": "../../../contracts/reports/specialist-report.v2.json",
  "output_schema_sha256": "c4962bab2a7c99a1a94486c698c1be554b66f1d199b58183538e611b611e2c39",
  "runtime_entrypoint": "runner/cli.mjs",
  "canonical_output": "SpecialistReportDocumentV2",
  "projection_policy": {"summary_and_full_share_source_sha": true, "html_is_canonical": false, "pdf_is_canonical": false},
  "preconditions": ["confirmed product identity and assigned material scope", "task-scoped capability token"],
  "permissions": ["profile.read", "material.read", "evidence.read", "user_validation.checkpoint.write", "user_validation.result.write"],
  "failure_classes": ["VALIDATION", "AUTHORIZATION", "DEPENDENCY", "BUDGET", "POLICY", "SUBMISSION_UNKNOWN"],
  "budget": {"max_cost": 0, "currency": "USD", "max_model_turns": 12, "max_agent_iterations": 32, "task_timeout_seconds": 1200},
  "evidence_requirements": ["simulation is never score-bearing", "claims without valid evidence are pending validation", "summary and full are selectors over one immutable source SHA"],
  "lifecycle": {"status": "APPROVED_DISABLED", "feature_flag": "LAUNCHSCOPE_REPORT_V2_ENABLED", "rollback": "Disable report v2 for new Runs and retain immutable 1.1.0 results."},
  "may_write_business_state": false
}
