{
  "schema_version": "3.0",
  "skill_code": "business-investment-assessment",
  "version": "2.0.0",
  "content_sha256": "d07e3f61f00981e280611d4cb39cbfd00c4e6aba7570bb0713bac6a3daa2ec00",
  "package_sha256": "2349dcfe2ff34fabd25203934f5aac72f7f46a87994c0b18d70e347df7e1019e",
  "runner_sha256": "cc57e5a5ef1ddc97451b2321697c10b8443d167822d0592666f18d4b0e9004af",
  "prompt_sha256": "4ef49829675269a31db96e50f6b07f656d2ad23ade1962333acef01a6967fad5",
  "knowledge_package_sha256": "4919b40c9ccff10819c077d825478aec7fdfdf69119e1d251112f89fc90d9e3c",
  "input_schema_ref": "../../../business-investment-assessment/schema/input.schema.json",
  "input_schema_sha256": "d1ba4e45a8a198ca992f39c76b659c2b6e5f0783ec5d9f453e522566f0f6684f",
  "output_schema_ref": "../../../contracts/reports/specialist-report.v2.json",
  "output_schema_sha256": "c4962bab2a7c99a1a94486c698c1be554b66f1d199b58183538e611b611e2c39",
  "runtime_entrypoint": "runner/cli.mjs",
  "canonical_output": "SpecialistReportDocumentV2",
  "projection_policy": {"summary_and_full_share_source_sha": true, "html_is_canonical": false, "pdf_is_canonical": false},
  "preconditions": ["confirmed product identity and assigned material scope", "authorized public research policy when external claims are required"],
  "permissions": ["profile.read", "material.read", "evidence.read", "public_research.read"],
  "failure_classes": ["VALIDATION", "AUTHORIZATION", "DEPENDENCY", "BUDGET", "POLICY", "SUBMISSION_UNKNOWN", "BUSINESS"],
  "budget": {"max_cost": 0, "currency": "USD", "max_model_turns": 10, "max_agent_iterations": 24, "task_timeout_seconds": 600},
  "evidence_requirements": ["facts, assumptions, and ranges remain separate", "market competition and legal claims include source region and time metadata", "unit-economics inputs are named and unsupported precision is prohibited"],
  "lifecycle": {"status": "APPROVED_DISABLED", "feature_flag": "LAUNCHSCOPE_REPORT_V2_ENABLED", "rollback": "Disable report v2 for new Runs and retain immutable 2.0.0 results."},
  "may_write_business_state": false
}
