{
  "schema_version": "3.0",
  "skill_code": "product-technical-audit",
  "version": "1.0.0",
  "content_sha256": "a749c234c8d2b71bb8610761b8302b9cb34512fd6646c95ce9ff2f8eacc3cea3",
  "package_sha256": "28492a94865617faba55e8498d40939923f6e0629caabf010a69d6d26da13391",
  "runner_sha256": "c1cddabbe67cfa2db365b7f84b0b33ea11321840a96df1c1775709775f479892",
  "prompt_sha256": "67813f840779045fa6fe76354f6785400bd08f48443ffdde2cf65f304f191bbf",
  "knowledge_package_sha256": "82ab6cb8ee0c1f2c7949303519ef7d63dba693229440af74ec9541c395f061e3",
  "input_schema_ref": "../../../product-technical-audit/schema/input.schema.json",
  "input_schema_sha256": "27775e4696fe790810de91afd5d613c818c3cc77a238e3742f3421ba00459bb0",
  "output_schema_ref": "../../../contracts/reports/specialist-report.v2.json",
  "output_schema_sha256": "c4962bab2a7c99a1a94486c698c1be554b66f1d199b58183538e611b611e2c39",
  "runtime_entrypoint": "runner/cli.mjs",
  "canonical_output": "SpecialistReportDocumentV2",
  "projection_policy": {"summary_and_full_share_source_sha": true, "html_is_canonical": false, "pdf_is_canonical": false},
  "preconditions": ["confirmed product identity and assigned material scope", "read-only product or repository evidence"],
  "permissions": ["profile.read", "material.read", "evidence.read", "browser.read", "repository.read"],
  "failure_classes": ["VALIDATION", "AUTHORIZATION", "DEPENDENCY", "POLICY", "SUBMISSION_UNKNOWN"],
  "budget": {"max_cost": 0, "currency": "USD", "max_model_turns": 10, "max_agent_iterations": 24, "task_timeout_seconds": 600},
  "evidence_requirements": ["stage and core-flow claims cite code, runtime, browser, or assigned material evidence", "team architecture statements remain pending until independently verified", "stage gates are observable and repeatable"],
  "lifecycle": {"status": "APPROVED_DISABLED", "feature_flag": "LAUNCHSCOPE_REPORT_V2_ENABLED", "rollback": "Disable report v2 for new Runs and retain immutable 1.0.0 results."},
  "may_write_business_state": false
}
