{
  "schema_version": "3.0",
  "skill_code": "evidence-grounding-audit",
  "version": "2.2.0",
  "content_sha256": "bf44a352a0e56c9e4cd86a615f9a081b7fc0c40fbd9b11bf5729b0f4dcb1973f",
  "package_sha256": "92402357c09c4850bf53c3814a2f2f29eab16da8471ca31125494a3ba930f195",
  "runner_sha256": "cd14704c50cfa3cd9f774ea30b91653ede65705558170c10625d4d8e7892f1f1",
  "prompt_sha256": "daaefa7ec808caa8b9a6cc6d7e8b50f90cef6484a01983bd0d590586ae07845f",
  "knowledge_package_sha256": "c217aa03863ae7ddf77d176bee42431374e9f3e52da69018b67adcc6ead70a75",
  "input_schema_ref": "../../../evidence-grounding-audit/schema/input.schema.json",
  "input_schema_sha256": "ac9d018f2526138e710e16d81c3e11ae0c7d2432be6697006e37e73a0385d300",
  "output_schema_ref": "../../../contracts/reports/specialist-report.v2.json",
  "output_schema_sha256": "c4962bab2a7c99a1a94486c698c1be554b66f1d199b58183538e611b611e2c39",
  "runtime_entrypoint": "runner/cli.mjs",
  "canonical_output": "SpecialistReportDocumentV2",
  "projection_policy": {"summary_and_full_share_source_sha": true, "html_is_canonical": false, "pdf_is_canonical": false},
  "preconditions": ["auditable findings and immutable specialist report references", "task-scoped evidence-auditor capability"],
  "permissions": ["evidence.read", "evidence_source_locator.read", "finding.read", "specialist_report.read"],
  "failure_classes": ["VALIDATION", "AUTHORIZATION", "DEPENDENCY", "POLICY"],
  "budget": {"max_cost": 0, "currency": "USD", "max_model_turns": 8, "max_agent_iterations": 16, "task_timeout_seconds": 600},
  "evidence_requirements": ["support strength source independence freshness and conflicts are explicit", "unsupported claims cannot score", "default labels are user-facing while raw audit codes remain in details"],
  "lifecycle": {"status": "APPROVED_DISABLED", "feature_flag": "LAUNCHSCOPE_REPORT_V2_ENABLED", "rollback": "Disable report v2 for new Runs and retain immutable 2.2.0 results."},
  "may_write_business_state": false
}
